job_source,keyword,job_title,company,job_description,job_id
Jobstreet,Computer Science,Programmer,PT Microvac Indonesia,"Programmer
Job Summary:
To develop web applications and services on Microsoft .NET platform.
Job Responsibility:
• Code, test and debug on back-end and front-end.
• Active involvement in all phases of software development life cycle including analysis, design, development, testing and support.
• Take ownership of the quality and timeliness of deliveries.
• Maintain accurate and up to date documentation of code and its changes.
• Provide assistance to junior developers.
Primary skills (Must have):
• Good understanding of Object Oriented Programming and design patterns.
• C#, .NET platform, Typescript, Javascript and HTML.
• Good knowledge of RESTful design and services.
• Good knowledge of database design, SQL, and Entity Framework Core.
• Strong analytical and problem solving skills.
• Ability to understand business requirements and translate them into technical requirements.
Secondary skills (Nice to have):
• Angular Framework (Major plus)
• CSS, LESS, SCSS
• Continuous Integration / Continuous Delivery (CI/CD)
• Microservice knowledge, docker, and kubernetes.
Job Type: Full-time",0
Jobstreet,Computer Science,IT Support Intern,PT Panin Dai-ichi Life,"Currently pursuing Bachelor degree with major in Information Technology / Computer Science
Excellent organizational skills
Strong interpersonal skills
Highly adaptable and able to work independently
Excited by new challenges and learning opportunities
Detailed and data oriented
6 months of hands-on work experience starting from the first day of your internship
Training in systems and procedures by experienced members of our team",1
Jobstreet,Computer Science,IS (Information System) Manager,PT Toray Industries Indonesia,"Developing and implementing IT strategies, planning for budget and infrastructure needs.
Managing IT projects, from planning to execution, ensuring they are completed on time and within budget.
Collaborate with other departments and stakeholders to understand business needs and propose IT solutions.
Leading and motivating IT team members, providing guidance and support, and ensuring effective performance.
Managing and maintaining the company's IT infrastructure, including servers, networks, security and communication systems.
Implementing and maintaining security measures, ensuring compliance with IT regulations and industry standards.
A degree in Information Technology, Computer Science, or a related field.
Strong project management, analytical thinking and problem-solving skills with the ability to analyze business needs and propose IT solutions.
Excellent leadership, communication (verbal/written) and interpersonal skills for cross-team collaboration.
Have knowledge or experience in implementing and maintaining system application (sales, production and accounting business knowledge are a plus). Preferably proficient in using Microsoft .NET, Microsoft SQL Server and Oracle.
Have knowledge or experience in managing and maintaining the company's IT infrastructure, including servers, networks, security and communication systems.",2
Jobstreet,Computer Science,IT PROGRAMMER,PT Indo Taichen Textile Industry,"Handle Full Stack develop to department request
Develop, maintain and support web application existing & new project
Create a web application that is controlled by the database
Bachelor's Degree in Computer Science/Information Technology or equivalent.
At least 1-2 Year of working experience in the related field is required for this position (will be advantage)
Fresh Graduate welcome to apply
Required Skill(s): Pemograman PHP, Framework Laravel/CI4, Flutter, android studio;  database mySQL, DB2/SQL
Required language(s): English
Placement in Tangerang",3
Jobstreet,Computer Science,Junior .NET Developer,PT Perangkat Lunak Indonesia,"Candidate must possess at least one of the following: SMK, Diploma, or Bachelor's Degree in Computer Science/Information Technology or equivalent fields.
Required language(s): Bahasa Indonesia, English
1 year working experience in the related field for this position (fresh graduates are welcomed).
Good communication skill.
Open to learn new software development technologies and platforms.
Write clean and readable code based on business requirements and coding standard.
Participating in technical discussion and meetings.
Ensuring the technological watch in your area of knowledge.
Experienced in web development using ASP.NET MVC (C#) or .NET Core (C#)
Experienced in Database Operations (SQL Queries, Stored Procedures, Views, etc.)
Experienced in front-end web technologies (HTML, CSS, JavaScript)",4
Jobstreet,Computer Science,IT Progammer,PT Allure Alluminio,"Responsible in supporting the full software development of new and existing applications.
Optimise application for maximise speed and scalability.
Maintaining the system, new feature, bug fixing, code refactoring and performance optimisation.
Possess the ability to translate ideas into functioning features
Deliver high quality application and system support
Any other ad-hoc duties as required or assigned
Bachelor degree in Computer Science
Fresh Graduate are welcome
Strong hands-on programming skills
Able to work independently
Good to have knowledge of Pyhthon, Json, SQL, Java
Willing to be placed at Kelapa Gading",5
Jobstreet,Computer Science,IT Quality Assurance,PT. LAKES KONSTELASI DATA,"Design, develop, and implement comprehensive test scenarios and scripts to ensure overall product quality.
Execute both manual and automated testing to identify bugs, system defects, and inconsistencies.
Analyze test outcomes and compile detailed bug reports with actionable recommendations for improvements.
Perform thorough regression testing following system fixes or updates to ensure functionality and stability.
Collaborate closely with development teams to understand technical specifications and business requirements.
Contribute to the design of aesthetically pleasing, responsive, and user-friendly user interfaces (UI).
Conduct usability testing and refine designs based on test results and user feedback.
Candidates must hold a minimum of a Diploma or Bachelor's Degree in Computer Science, Information Technology, or a related field.
Previous experience in quality assurance or software/application testing is highly preferred.
A strong understanding of both manual and automated testing methodologies is advantageous.
Experience with QA tools such as Selenium, Appium, and Postman is a plus.
Demonstrates strong critical thinking, analytical, and problem-solving abilities.
Familiarity with UI/UX design principles and usability testing is a plus.
Fluency in both Indonesian and English is required.
A proactive and responsible individual with a strong sense of ownership.
Must possess a personal vehicle and a valid driver's license.
Applicants should be no older than 30 years of age.",6
Jobstreet,Computer Science,Bootcamp IT Consultant / Programmer (Fresh Graduate),PT Indocyber Global Teknologi,"Minimum S1 in Computer Science/Information Technology/ Mathematics/Physics/Telecommunication
Fresh graduates / Entry level applicants are encouraged to apply
Minimum 3.00 GPA
Age maximum 25 years old
Required skill(s): basic programming, algorithm, logic
Understand relational databases Microsoft SQL Server and its query language
Have a high interest in software engineering as Developer
Fast learner and highly logical thinker
Good communication and eagerness to learn
Training will be held at Grogol / Daan Mogot area (West Jakarta)
30 Full-Time position(s) available",7
Jobstreet,Computer Science,IT Infrastructure Project Manager,PT Netmarks Indonesia,"We are looking for an IT Project Manager to join our Technical Team. You will be responsible for managing, coordinating, and completing the project on time within scope. You will also be responsible for setting deadlines, assigning responsibilities, and monitoring and summarizing the progress of the project. And prepare reports for the Technical Manager regarding the status of the project.
 Responsibilities:
1. Directs and manages end to end process of the project and the team
2. Facilitates communication between the project team and project owner daily
3. Scheduling project milestones, management, and delegation of the project task
4. Monitors project progress by tracking activity
5. Ensures project issues are identified, tracked, reported and resolved
6. Compile periodic project reports to be given to the project owner
7. Create and maintain comprehensive project documentation (functional requirements documents, business requirement documents, use case documents, and minutes of meeting documents)
 Specific Requirements:
1. Bachelor's degree in Informatics Engineering, Computer Science, or similar studies.
2. Fresh Graduates are welcome with a GPA minimum of 3.00 from a reputable university
3. Experience as a Project Manager in IT Projects is preferable.
4. Be meticulous and have attention to detail in performing the work.
5. Good communication and presentation skills
6. Good leadership skill
7. Strong analytical thinking, negotiation, and problem-solving skills
8. Have excellent interpersonal skills
9. Have excellent written and verbal communication skills (in English and Bahasa Indonesia)
10. Solid organizational skills including attention to detail and multitasking skills
 Additional factors We Appreciate:
1. Able to work fast and under pressure
2. Certification of Project Management Professional (PMP) is an advantage
3. Willing to work overtime and on tight deadlines",8
Jobstreet,Computer Science,System Administrator Engineer,PT Sinergi Wahana Gemilang,"S1 graduates from IT majors or Computer Science.
Having experience in the field of system administrator, network administrator, or other relevant positions.
Understand operating systems such as Windows, Linux, or MacOS
Understanding the language programming especially for scripting or automation is an additional value
Understanding Network Security, Intrusion Detection Systems, and Other Security Technology
Understand network protocols, topologies, and other security concepts
Experience for cloud platforms such as Microsoft Azure or AWS is an additional value",9
Jobstreet,Computer Science,Fresh Graduate Functional Consultant,PT Amber Solusi Internasional,"Actively involved in business requirement analysis/user stories
Meet with business users throughout the organization to understand their business objectives, technical challenges and data needs, and prepare functional design document
Leading review sessions with business users to review functional design
Develop and maintain system level artifacts, such as flow diagrams, process diagram, and current and proposed state diagrams
Intensive discussion with development team to ensure the development as per functional design
Doing application testing and SIT
Leading User Acceptance Testing
Leading End User Training
Write and maintain related project documentation
Manage postproduction support activities
Detail person and strong logic
Willingness to take ownership of highly challenging tasks and problems
Thorough and analytical problem-solving skills
Effective communication and interpersonal skills
Have sense of leadership
Bachelor's degree in Information Systems, Computer Science, or related major with GPA > 3.00
Fresh Graduates are welcome to apply
Having internship experience as Business Analyst, System Analyst, or Functional Consultant is a plus
Having knowledge in software development methodology
Dynamic and result oriented team player
Have decent English",10
Jobstreet,Computer Science,AI Specialist â€“ Machine Learning Model Developer,PT Allure Alluminio,"Research and integrate cutting-edge AI techniques into the company’s operations and processes.
Collaborate with cross-functional teams to identify business challenges and design AI-driven solutions.
Implement robust data preprocessing, feature engineering, and model optimization techniques.
Ensure the scalability, accuracy, and efficiency of the developed models.
Develop frameworks for testing, validating, and maintaining models.
Education: Bachelor’s degree in Computer Science, Artificial Intelligence, Data Science, or a related field.
Fresh Graduated are welcome.
Strong expertise in data analysis, algorithm development, and feature engineering.
Familiarity with Zapier and Make.com
Excellent communication and collaboration skills.
Willing to be placed at Kelapa Gading",11
Jobstreet,Computer Science,Data Engineer,PT Indocyber Global Teknologi,"Bachelor degree in Computer Science, or IT related fields
3 years of Data Modeler, Data Engineering, ETL developer or a related field
Experience using Informatica, Python 
Experience using SSIS, SSAS, SSRS, Pentaho, PowerBI, Cloudera, Azure Databricks, Azure Data Factory, Unity Catalogue
Communication skills, especially explaining technical concepts to non-technical business leaders.
Exposure in Datalake, Kafka, Tableau
Design, implement and manage end to end data pipelines (ETL, data streaming and data warehousing) to make data easily accessible for analysis.
Design end to end ETL as per-use cases and business requirements
Ensure high data quality and integrity from data sources.
Identify, design, and implement internal process improvements: automating manual processes, optimizing data delivery, re-designing infrastructure for greater scalability, etc.
Troubleshoot complex data issues and perform root cause analysis to proactively resolve product and operational issues",12
Jobstreet,Computer Science,Middle Software Engineer,PT Aegis Ultima Teknologi,"Job Responsibilities :
Collaborate with Product Owners and System Architects to understand features and user stories.
Estimate story points and contribute to team capacity planning.
Write clean, maintainable and scalable code following best practices based on business and technical requirement
Perform unit testing, support integration testing, and regression testing.
Fix bugs and continuously improve code quality.
Document code, APIs, and architectural decisions for future reference.
Ensure compliance with security, regulatory, and governance requirements.
Actively involved in R&D activity
Requirements :
Qualifications:
Location  : Yogyakarta",13
Jobstreet,Computer Science,Product Manager - Enterprise Datacom & Network Infrastructure,PT Talenta Eksekutif Asia (Matcha Talent),"Lead technical engagement with enterprise clients, analyzing needs and designing tailored Datacom and IP networking solutions.
Collaborate with sales and solution teams to convert leads into opportunities, from proposal to closure.
Promote enterprise Datacom offerings (WLAN, switches, routers) across sectors including government, FSI, transportation, and more.
Execute branding and pricing strategies based on competitor insights and market positioning.
Guide technical solution development across project lifecycle: requirement mapping, design, bid support, and delivery handover.
Define mid- to long-term business goals, resource planning, and market entry strategies.
Monitor project performance and ensure post-sales success and customer satisfaction.
Bachelor’s degree in Computer Science, Telecommunication Engineering, or a related field.
Minimum of 6 years in the ICT/telecommunications industry, with a focus on enterprise solution presales and account management.
Demonstrated experience in technical project operations, proposal creation, and managing end-to-end client engagements.
Proficient in Datacom technologies: WLAN (Wi-Fi), campus/data center switches, access/edge/core routers.
Strong understanding of networking protocols such as IGP, BGP, SR, MPLS, SRv6, L2VPN, L3VPN.
Familiarity with enterprise and carrier-grade network architectures.
Excellent communication, relationship-building, and cross-functional collaboration skills.
Strategic thinking with high adaptability in fast-paced, competitive environments.
Capable of handling complex sales cycles and building long-term client trust.
Join a world-renowned ICT innovator with market-leading enterprise solutions.
Work on impactful digital transformation projects across Indonesia’s top sectors.
Advance your career in a high-performance, globally connected environment.",14
Jobstreet,Computer Science,IT Product Specialist (Mandarin Speaker),PT Global Jet Express,"Collaborating with prospective users and clients to understand and anticipate their needs and translate them into product requirements
Defining the vision for the team’s product and creating a product road map based on this vision
Managing the product backlog and prioritizing them based on changing requirements
Overseeing all stages of product creation including design and development
Developing user stories
Monitoring, evaluating product progress at each stage of the process, also participating in product acceptance testing
Liaising with the product team and end-users to deliver updates
Lead or participate in Scrum meetings and product sprints
Bachelor's degree in computer science or information technology, or equivalent experience
Fresh graduates are welcome to apply
Written and verbal communication skills in English & Mandarin, preferable in the Mandarin language
Experience with Scrum and agile methodology
Critical and creative thinking ability
Excellent analytical skills and strong problem-solving capacity
Product and project management skills
Ability to work under pressure and to tight deadlines
Knowledge of UI wireframe and prototyping tools
Experience with API integration
Willing to be placed in Pluit, Jakarta Utara (Head Office)",15
Jobstreet,Computer Science,IT Application (SAP ABAP) Assistant Manager,PT Nipsea Paint & Chemicals,"Candidate must possess at least Bachelor/S1 degree, preferably in Computer Engineering / Computer Science / Information Technology / Information System, or equivalent.
Experience in SAP is must.
Minimum 3-5 years in handling SAP ABAP.
Good understanding to debug SAP standard program.
Good knowledge about FI, CO, SD, MM, and PP modules.
Working knowledge or experience in manufacturing industries.
Excellent analytical and troubleshooting skills including logical thinking.
Has a good sense of business processes, process flow, and system integration point.
Excellent in verbal and written communication in both Bahasa Indonesia and English.
Willingness and flexibility to learn new technologies, scale up quickly, and adapt to different requirements or roles as the situation demands.
Strong multi-tasking skills and abilities to handle changing priorities in a fast-paced environment.
Strong focus and customer orientation, to manage user expectations.
Should work with minimum supervision.
Handle & troubleshoot SAP issues.
Ensure quick turnaround in identifying application issues and providing timely solutions.
Manage daily operational support, monitor, and solve any issues affecting the operations of the system and the scheduled background jobs of the customized program.
Undertake performance tuning activities for SAP integration activities.
Support functional team members as technical expert counterpart for customized program development analysis.
Build proper documentation (technical specifications) for any new program development and program changes.
Develop, code, and document new program development and program changes based on the agreed user requirements.
Ensure the user acceptance test (UAT) are well planned, executed, and documented.
Provide the assessment of change request (corrections, enhancements), propose and develop the required solutions.
Ensure compliance with IT policies and SOPs.",16
Jobstreet,Computer Science,Web Developer (Content Management & SEO Optimization),Geekhunter,"Website Development & Maintenance
- Continuously improve and maintain user-friendly and responsive WordPress websites and Salesforce landing pages.
- Troubleshoot website issues, manage plug-ins, and ensure uptime and performance.
- Apply UI/UX best practices to improve interface quality and user satisfaction.
- Ensure seamless CMS workflows for fast content updates and scalability across business units.
SEO Strategy & Content Relevance
- Lead technical and on-page SEO: audits, metadata optimisation, schema markup, keyword strategy, and load speed performance.
- Use tools like Google Analytics, Search Console, SEMrush, Yoast, and MS Clarity to analyse traffic and identify optimisation opportunities.
- Develop internal linking and white-hat backlink strategies to improve organic ranking and domain authority.
- Monitor performance metrics and adjust SEO tactics based on search trends and algorithm updates.
Content Management & AI-Powered Enhancement
- Efficiently manage and update website content across multilingual platforms to support marketing campaigns.
-Use generative AI tools (e.g. OpenAI/GPT) to enhance relevance, consistency, and volume of digital content.
- Collaborate with marketing and product teams to ensure timely updates, strong messaging, and clear calls to action.
Marketing & Integration Support
- Support campaign-specific landing pages, A/B testing, and personalisation using Salesforce Account Engagement and other MarTech tools.
- Manage marketing automation flows using Zapier and other integrations.
- Work closely with stakeholders to gather feedback and continuously improve the digital user journey.",17
Jobstreet,Computer Science,Architect/Functional HCM,"PT SMART,Tbk","Support business users in the development, implementation, and support of SAP HR/HCM module.
This role uses consulting skills, business knowledge, and SAP solution expertise to effectively integrate SAP technology into the business user’s business environment in order to achieve client expected business results.
Candidate must possess at least a Bachelor's Degree, Computer Science/Information Technology, Engineering (Computer/Telecommunication) or equivalent.
Fresh graduate are welcome to apply
Ability to understand business requirements and convert them into solution designs
Knowledge of web-based systems architecture, service-based architecture, enterprise application architecture
Placement in MSIG Office Jakarta",18
Jobstreet,Computer Science,"Software Engineer, Backend (Lending)",PT Solusi Transportasi Indonesia,"Develop applications using GoLang, ensuring clean and efficient code.
Identify main tasks, manage them throughout the software development life cycle, and automate tasks.
Work with multiple teams to define requirements, design new features, and deliver them.
Lead coding standards efforts, conduct code reviews, troubleshoot, debug, and update existing software.
Stay updated with the latest technologies to improve products and processes, and mentor junior engineers to support their growth..
Bachelor in Computer Science or equivalent.
Experience shipping products (like web applications or backend services, etc.) to production.
You can be a good coder in any language, but willing to work on Golang
Ability to communicate in Bahasa Indonseia and English
Experience automating tasks using appropriate tools and scripting, and experienced in conducting code reviews to ensure high coding standards.
Collaborate with multiple teams and staying updated with new technologies and security practices.
We have your back with Term Life Insurance and comprehensive Medical Insurance.
With GrabFlex, create a benefits package that suits your needs and aspirations.
Celebrate moments that matter in life with loved ones through Parental and Birthday leave, and give back to your communities through Love-all-Serve-all (LASA) volunteering leave
We have a confidential Grabber Assistance Programme to guide and uplift you and your loved ones through life's challenges.",19
Jobstreet,Computer Science,Software Developer (Bandung Area) - Mille ERP,PT. LAKES KONSTELASI DATA,"Collaborate with cross-functional teams to analyse requirements, design, and develop high-quality software applications
Write clean, maintainable, and efficient code using the latest programming languages and technologies
Participate in the full software development lifecycle, including coding, testing, debugging, and deployment
Continuously research and implement innovative solutions to enhance our products
Troubleshoot issues to ensure the smooth operation of our software applications
Contribute to the development of best practices, coding standards, and documentation
Stay updated with the latest industry trends and technologies to drive continuous improvement
Bachelor's degree in Computer Science, Information Technology, or a related field
Strong proficiency in any programming languages
Knowledge of agile software development methodologies and project management tools
Excellent problem-solving, analytical, and critical thinking skills
Effective communication and collaboration abilities to work in a team environment",20
