job_source,keyword,job_title,company,job_description,job_id
LinkedIn,Informatics,RPA Business Analyst,PT Hermes Solusi Integrasi ,"- Previous experience working as a business analyst on an Automation/RPA team preferred.
- ⁠Work with teams in the identification of business requirements, functional design, process design (including scenario design, flow mapping), prototyping, testing, training, defining support procedures
- Excellent, proactive problem solver, strong analytical skills with the ability to analyse complex requirements and define technical/functional advanced solutions.
- Excellent communication skills in both written & verbal English (and have worked in global/multicultural environment).
- Ability to interact with both technical and non-technical stakeholders as part of the RPA delivery cycle.
- Ability to understand and create business process workflow diagrams or procedural documentation
- Exposure to performance measurement and continuous improvement methodologies like Lean or Six-Sigma, preferred
- Identify business opportunities to increase usability and profitability of information architecture.
- Experience with leadership, governance and change enablement.
- Previous experience working as a business analyst on an Automation/RPA team preferred.
- Work with teams in the identification of business requirements, functional design, process design (including scenario design, flow mapping), prototyping, testing, training, defining support procedures.
- Excellent, proactive problem solver, strong analytical skills with the ability to analyse complex requirements and define technical/functional advanced solutions.
- ⁠Excellent communication skills in both written & verbal English (and have worked in global/multicultural environment).
- Ability to interact with both technical and non-technical stakeholders as part of the RPA delivery cycle.
- Ability to understand and create business process workflow diagrams or procedural documentation
- Exposure to performance measurement and continuous improvement methodologies like Lean or Six-Sigma, preferred
- Identify business opportunities to increase usability and profitability of information architecture.
- Experience with leadership, governance and change enablement.
- Develop and manage vendor relationships
- Formulate planning, budgeting, forecasting and reporting strategies
- ⁠Develop and manage vendor relationships.
- Formulate planning, budgeting, forecasting and reporting strategies",177
LinkedIn,Informatics,Wintel System Administrator,UOB,"Administration and technical support of Windows Server Operating System environment including Active Directory and MS Exchange email system.
Responsible for the installation, and configuration of an Windows Server based computing system.
Diagnose server hardware and software problems to develop a workable solution.
On-call support in the event of an emergency
Write and rewrite technical documentation.
Provide technical guidance to internal staff.
Take a proactive approach to monitoring platforms and services, identifying and predicting problems prior to them developing into emergencies
Familiarity with Microsoft Windows Server Operating System, Exchange Server and Active Directory, with problem-solving abilities.
Familiarity with Sever hardware (i.e. HP server family)
Familiarity with Microsoft software with troubleshooting and problem-solving abilities
Strategise
Engage
Execute
Develop
Skills
Experience",178
LinkedIn,Informatics,Application Engineer,Johnson Controls,"Technical Expertise:
Customer Support:
Sales Support:
On-Site Visits:
Training:
Design Assistance:
Relationship Building:
Market Analysis:
Technical Documentation:
Problem Solving:
Strong technical background in relevant engineering disciplines (electrical, mechanical, etc.)
Excellent communication and presentation skills to explain complex technical concepts to non-technical audiences
Project management skills to manage customer implementations and technical projects
Ability to travel frequently to customer sites
Strong problem-solving and analytical skills to diagnose technical issues",179
LinkedIn,Informatics,Fullstack developer (Dot net & angular),Asiatek Solusi Indonesia,"Back-End Web Development and Full-Stack Development skills
Front-End Development and Cascading Style Sheets (CSS) skills
Experience in software development
Knowledge of Dot net and Angular frameworks
Strong problem-solving and analytical skills
Ability to work both independently and in a team environment
Bachelor's degree in Computer Science or related field",180
LinkedIn,Informatics,Analis LAB QC | Novell Pharmaceutical Laboratories,State University of Malang,"Sorry, your browser doesn't support embedded videos, download <\/a> and watch with your favorite video player! ""}},""inView"":false,""email_subject"":""Check out this awesome image !!"",""email_message"":""Here is the link to the image : %%image_link%% and this is the link to the gallery : %%gallery_link%%"",""grid_type"":""automatic"",""rowHeight"":250,""lastRow"":""justify"",""lightbox"":""fancybox""}"">",181
LinkedIn,Informatics,QA Engineer 2 (Mekari Jurnal),Mekari,"Define, describe, review test cases for all requirements
Collaboration with team (Engineer, Product Owner and etc) regarding new feature and existing features
Define edge cases and improve test cases coverage close to 100%
apply automation testing approach along with exploratory / manual test
Increase automation test coverage and maintain automation test suite
Define and improve “done” criteria in collaboration with the lead for release candidates
Make sure highest quality code deliver to production with no/minimum critical/major issue
Passion as a problem solver
Proactive, vigilant, responsible, and collaborative
Experience with UI (web and mobile) and API testing
Experience with test management and project management tools like jira, etc
Experience using automation test tools (cucumber, selenium, appium, etc)
Experience with automation testing frameworks (TDD/BDD/ATDD)
Knowledge/Experience of load testing (capacity) tools like jmeter, locust, etc
Knowledge/Experience working with cloud based systems, CI/CD, Git, shell, etc
Understanding of Agile Methodology
Quite fluent in English",182
LinkedIn,Informatics,IngÃ©nieur SystÃ¨me (H/F),Sulzer Turbo Services Indonesia,"General knowledge of software development
Network: battery, sockets, TCP/IP, UDP, FTP
Linux
Knowledge of the development cycle
Use Suite Office
O.S real time
Web services
Database
Mantis, link test
Configuration management
Development of on -board or real -time systems.
Reporting
Functional architecture
Specification",183
LinkedIn,Informatics,Multi Skilled Engineer (Electrical),Sulzer Turbo Services Indonesia,"Provide maintenance at the student accommodation sites in Kingston upon Thames
Provide initial response to all Reactive Maintenance requests during normal working hours and Out of Hours as part of the On-call Out of Hours Rota
Undertake replacements of electrical appliances and fittings as needed
Quarterly shower head & hose cleaning in accordance with L8 requirements (full training will be provided)
Monthly temperature monitoring of Hot & Cold water systems
Continuous monitoring and maintenance of mechanical systems, fittings and plantrooms
Weekly flushing of water outlets in all unoccupied rooms
Weekly fire alarm testing on the student accommodation
Bi-annual Fire Door inspections (full training will be provided), ensuring necessary adjustments are completed / faults & damage recorded accurately
Undertake minor repairs to faults reported within student bedrooms and shared kitchen facilities covering all elements of building Fabric, Fixtures & Fittings
Carry out replacement of luminaires & general LV outlets & accessories
24 days annual leave (+ public holidays)
Life Cover equivalent to 1.5 times annual salary
Employee discount shopping schemes on major brands and retailers
Gym membership discounts
Cycle to work scheme
Holiday purchase scheme
2 corporate social responsibility days per year
Broad range of learning opportunities, such as professional qualifications, collective/individual training, and personalized support programmes
Attractive Employee Referral Rewards Scheme
Access to our growing employee networks including WiE (Women in Equans), RISE (BAME), LGBTQI+, Working Parents, YPN (Young Persons Network) and our Disability Network
24/7 Employee Assistance Program and access to mental wellbeing app
Demonstrable experience in a similar role essential
Suitable Electrical qualification (minimum NVQ level 3 or equivalent)
Working knowledge of ACOP L8 desirable
Ability to work to tight deadlines, under own initiative or through instruction
Full UK driving licence",184
Jobstreet,Computer Science,Staff System & Network Engineer,PT Abadi Tambah Mulia Internasional,"Configure and install various devices and services (e.g. servers, routers, switches, firewall, load balancers, VPN)
Manage and monitor all installed system and infrastrukture
Install, configure, test and maintain operating system, application software and system management tools
Perform network maintenance and system upgrades including service packs, patches, hot fixes, and security configuration
Monitor performance and ensure system availability and reliability
Monitor system resource utilization, trending, and capacity planning
Maintain security, backup, and redundancy strategies
Provide Level 1-2 support and troubleshooting to resolve issues
Work within established configuration and change management policies to ensure awareness, approval and success of changes made to the network infrastructure
Select and implement security tools, policies, and procedures
Liaise with vendors for problem resolution
Create user requirement and detail design system based on road map development
Create and update the topology of system
Basic-understanding of networking protocols (e.g. IPSEC) and TCP/IP model
Experience with monitoring system, ISO 8583, WDSL, API, and XML
Familiarly working with database application & device handler
Familiarly using Microsoft Visio
Bachelor degree minimum in Computer-science, Engineering or a related subject
Fresh graduated are welcome but having experience will be advantage",185
Jobstreet,Computer Science,QNB Indonesia Aspire Internship Program (IT Internship),PT Bank QNB Indonesia Tbk,"Support the preparation and maintenance of project and operational documentation
Assist in tracking project milestones and deliverables within SDLC frameworks
Assist in documenting data structures and data governance standards
Contribute to the development and maintenance of ITSM governance documents
Ensure documentation is up to date and compliant with IT governance standards
Assist in troubleshooting issues related to End User Computing (EUC), servers, and basic network infrastructure
Final-year student or recent graduate (Bachelor) in Information Systems, Computer Science, Engineering, or a related field
Strong attention to detail and documentation skills
Strong analytical thinking with the ability to translate technical issues into structured documentation
Proficiency in Microsoft Office tools (Excel, Word, PowerPoint)
Familiarity with basic data concepts, SQL, and data analytics
Interest in data engineering, data warehousing, and IT operations
Willingness to troubleshoot technical issues and support IT service processes",186
Jobstreet,Computer Science,IT Infrastructure,PT Dipo Star Finance,"Assist in collecting and analyzing data related to infrastructure needs and performance.
Support in preparing documentation for IT infrastructure projects (e.g., network upgrades, data center expansions, hardware deployments).
Coordinate with cross-functional teams (Network, Security, Operations) to gather requirements and monitor progress.
Help prepare project reports, presentations, and planning schedules.
Maintain documentation of IT assets and planning artifacts.
Assist with vendor evaluations and procurement planning under supervision.
Stay updated with IT infrastructure trends to contribute fresh ideas.
Solid understanding of IT infrastructure components (servers, networks, storage, cloud).
Experience with project management tools and concepts (e.g., Gantt charts, work breakdown structure).
Proficiency in Microsoft Office tools, especially Excel, PowerPoint, and Word.
Familiar with ITIL or project management methodologies.
Experience with Visio or other diagramming tools is a plus.
Strong analytical and problem-solving skills.
Effective verbal and written communication.
High attention to detail and ability to document clearly.
Ability to work independently and as part of a collaborative team.
CompTIA IT Fundamentals+
ITIL Foundation
Google IT Support Certificate or similar",187
Jobstreet,Computer Science,IT Manager,Indonesia Equipment Centre,"Manage the maintenance, monitoring, and security of servers, networks, data centers, and endpoints.
Ensure optimal performance and availability of IT systems and infrastructure.
Develop, implement, and maintain IT policies, procedures, and roadmaps.
Align IT strategies with business objectives to drive digital transformation.
Lead and execute IT projects, including system upgrades, technology rollouts, and process improvements.
Collaborate cross-functionally to ensure successful project outcomes.
Develop and manage the IT budget, ensuring cost-effective solutions without compromising performance.
Manage relationships with vendors and service providers, including contract negotiations and SLA adherence.
Ensure data security and privacy measures are in place and maintained.
Oversee risk management practices and compliance with regulatory and industry standards.",188
Jobstreet,Computer Science,IT Support Intern,PT Puma Cat Indonesia,"Job Description 
• Assisting with technical support for staff via phone, email, remote desktop, or on-site. 
• Supporting systems including POS, SAP, Active Directory, and other business applications. 
• Helping set up and install workstations, including hardware and software configurations. 
• Supporting the configuration and maintenance of network equipment. 
• Escalating unresolved issues to senior IT staff in a timely manner. 
• Assisting with the inventory of IT hardware, software, and other technology resources. 
• Helping to repair and troubleshoot IT equipment (e.g., PCs, laptops, scanners, etc.). 
• Organizing and preparing servers and other equipment prior to system installation. 
• Supporting the disposal of old hardware according to company procedures. 
• Involvement in IT asset management, from acquisition to disposal. 
• Assisting in IT procurement processes and documentation (e.g., asset loans and returns). 
• Creating templates or tools for asset monitoring and management. 
Requirements 
• Currently enrolled in or recently graduated from an IT or Computer Science program. 
• Strong organizational and communication skills. 
• Able to work independently and as part of a team. 
• Willingness to work full-time under a contractual internship. 
• Prior work or internship experience in IT is a plus. 
• Passionate about technology and enthusiastic about learning. 
• Interest in the PUMA brand and sports is an advantage.",189
Jobstreet,Computer Science,IT Application Staff,"Koperasi Pegawai PT. Indosat,Tbk (Kopindosat)","Support and maintain internal web-based applications (Java & PHP)
Manage and optimize relational databases (MySQL & PostgreSQL)
Troubleshoot application issues and ensure smooth IT operations
Collaborate with the team to improve system performance and maintain documentation
Use Git/GitHub for version control
Work with tools like Postman for API testing
Contribute to developing and enhancing digital solutions that support our business processes
Diploma or Bachelor's degree in Computer Science, Information Technology, or related field
Proficient in Java and PHP (native or frameworks such as Spring Boot, CodeIgniter)
Skilled in MySQL and PostgreSQL databases
Familiar with Git/GitHub and API testing tools (e.g. Postman)
Basic knowledge of HTML, CSS, JavaScript is a plus
Experience with Odoo or previous IT projects is an advantage
Strong communication skills, team-oriented, and open to feedback",190
Jobstreet,Computer Science,IT Superintendent,PT Alfa Valves Indonesia,"Develop and implement IT strategies that align with the organization's objectives.
Collaborate with senior management to identify technology needs and opportunities.
Lead and mentor the IT team, fostering a culture of innovation and continuous improvement.
Oversee the design, implementation, and maintenance of IT infrastructure, including networks, servers, and systems.
Ensure the reliability, performance, and security of IT systems.
Manage hardware and software resources to meet organizational needs.
Implement and maintain cybersecurity measures to protect organizational data and systems.
Ensure compliance with relevant regulations and standards.
Conduct regular security audits and risk assessments.
Lead IT projects from initiation to completion, ensuring they are delivered on time and within budget.
Coordinate with stakeholders to define project scope and objectives.
Monitor project progress and resolve issues as they arise.
Familiar with ERP and other software
Recruit, train, and evaluate IT staff to ensure high performance.
Foster a collaborative and productive work environment.
Provide ongoing professional development opportunities for team members.",191
Jobstreet,Computer Science,Junior Server Engineer,PT. Berca Hardayaperkasa,"Final-year students or recent graduates with a Bachelor’s degree in Computer Engineering, Computer Science, Information Technology, or related fields
Have a high enthusiasm in IT Infrastructure (Server and Storage)
Have a basic knowledge of Server and Storage Technology
Familiar with Operating Systems: Windows, Linux, or others
Deep-dive knowledge in Server and Storage technologies
Gain practical experience in a professional IT environment, applying your knowledge to real-world scenarios
Valuable industry networking opportunities
A potential path to full-time employment",192
Jobstreet,Computer Science,IT Governance Project Staff,PT Tekno Gemilang Indonesia,"Min diploma’s degree in IT, Computer Science, or a related field.
Experience in IT Governance, compliance, or risk management.
Strong knowledge of IT governance frameworks and industry standards.
Familiarity with regulatory requirements in the organization's industry.
Excellent communication and interpersonal skills.
Strong analytical and problem-solving abilities.
Attention to detail and organizational skills.
Proficiency in risk assessment and management.
Knowledge of IT security principles and practices.
Strong understanding of compliance frameworks (e.g., ISO 27001, NIST).
Project management skills for handling GRC initiatives.
Ability to work both independently and as part of a team.
Strong documentation and reporting skills.
Controlling ongoing processes within IT to ensure that everything runs in accordance with applicable regulations.
Ensuring that IT work processes are effective and efficient.
Documenting work processes within the IT Division in the form of SOPs and similar documents to ensure process continuity.
Supporting the implementation of both internal and external audits in the IT Division to ensure a smooth audit process.
Following up on audit results to ensure the IT Division’s compliance with applicable regulations.
Carrying out operational activities within the scope of responsibility in accordance with the Information Security Management Standards (ISMS) to ensure that the company’s information assets are protected in line with established standards and regulations.",193
Jobstreet,Computer Science,"IT Intern (2 positions : Application Dev,  AI & Machine Learning)",IDS Medical Systems Group,"Carries out software development of the organization’s business applications which are aligned with idsMED Group’s strategies.
Responsible to develop application, unit testing, perform application change requests & develop reports based on the specifications provided
Fresh Graduates or Last-semester university student majoring in information system (IS)
Proficient in SQL, GitLab (a plus), and version control tools (Git, SVN).
Solid understanding of Agile/Scrum methodologies.
Full-stack skills: PHP (Laravel), NGINX, Flutter, Dart, JavaScript, CSS/SCSS, HTML, MS SQL, REST API, JWT.
Experience with front-end development and third-party API integration.
Strong analytical, problem-solving, and communication skills.
Familiar with writing and using test cases for debugging and performance optimization
Build dashboards and systems to monitor model metrics like accuracy, latency, and anomalies.
Run diagnostics and help resolve model drift, data issues, and production errors.
Assist with data prep and ETL workflows; write and optimize SQL for pipeline efficiency.
Document monitoring processes and support team-wide best practices.
Collaborate across teams and stay current with MLOps and data pipeline trends.
Bachelor's or Master's degree in Computer Science, Data Science, Mathematics, or a related discipline.
Eager to gain hands-on experience in the full lifecycle of machine learning and AI model operations.
Self-motivated with a willingness to take initiative.
Ability to handle ambiguity and work effectively in a dynamic setting
Keen interest in developing robust monitoring solutions, SQL-driven data insights, and efficient ETL pipelines to support scalable AI-driven applications.",194
Jobstreet,Computer Science,Full Stack Developer -JS Developer (Welcome Fresh Graduated),ATech Solution,"Collaborate: with senior developers to understand project requirements and contribute to the development process.
Learn: and apply various technologies, Collaborate with teams to design and implement features using Next.js, React.js, and TypeScript
Participate: in code reviews and learn best practices for software development.
Assist: in testing and debugging applications to ensure quality and performance.
Contribute: to the development of documentation and knowledge sharing within the team.
Stay updated: with the latest technologies and trends in web development.
Support: the team in identifying and resolving technical issues.
Fresh graduate: with a degree in Computer Science, Software Engineering, or a related field.
Strong: foundation in computer science principles and programming concepts.
Proficient in Next.js, React.js, TypeScript, Git, MongoDB, CSS, and HTML.
Fluent in written and spoken English.
Strong problem-solving skills and detail-oriented mindset.
Passion: for learning and a desire to become a proficient full-stack developer.
Good to Have:
Experience with integrating OpenAI or similar APIs.
Knowledge of socket connections and real-time communications.
Experience with SQL databases, message queues, orchestration, and time series data processing.
Experience with AWS ecosystem, DevOps, and Digital Ocean is a plus.
Experience with React Native or similar cross platform hybrid mobile development
 
Competitive salary and benefits package
Opportunities for career development and growth
Supportive and collaborative work environment
Training and development programs to enhance your skills
Flexible work arrangements and work-life balance initiatives",195
Jobstreet,Computer Science,Developer & Social Media Intern,POINTSTAR (PSID),"Develop AI-powered Applications: Contribute to designing, developing, and deploying AI-driven apps that streamline internal workflows and offer potential as commercial products.
Open Source Contribution: Actively use open-source frameworks and libraries to build solutions, ensuring high-quality, scalable, and maintainable code.
Collaborate with Teams: Work closely with internal stakeholders, including product managers and other developers, to understand business needs and translate them into technical solutions.
Prototype and Experiment: Participate in rapid prototyping, testing, and iterating on new ideas based on feedback.
AI Model Integration: Implement and fine-tune machine learning models for real-world applications, ensuring they are optimised for performance and scalability.
Code Review & Best Practices: Engage in code reviews, follow best practices for coding standards, and contribute to improving development processes.
Documentation: Document your work, including development processes, system architecture, and APIs, clearly and concisely.
Currently pursuing or recently completed a degree in Computer Science, Engineering, or a related field.
Willing to join for a minimum of 6 months with commitment.
Basic understanding of machine learning principles and AI algorithms.
Experience with at least one programming language such as Python, JavaScript, or Java.
Familiarity with open-source software development and related tools (e.g., Git, GitHub).
Exposure to popular machine learning libraries such as TensorFlow, PyTorch, or Scikit-learn.
Strong problem-solving skills and ability to think critically about business needs.
Willingness to learn new technologies and tools quickly.
Ability to work independently and as part of a collaborative team.",196
Jobstreet,Computer Science,Mobile Developer (Android),PT Lippo General Insurance Tbk,"Create program code, debug programs, and ensure application programs run according to the plan that has been made.
Coordinate with business analysts to define requirements before creating applications.
Bachelor's degree in Computer Science or Information Technology
Proficiency in Kotlin/Java, Android Studio, MVVM/MVC architecture
Good to have experience with popular libraries for networking, async, image loading etc
Have knowledge/experience using Git and RESTful API",197
