job_source,keyword,job_title,company,job_description,job_id
LinkedIn,Computer Science,Data Scientist (PT PEFINDO),KitaLulus,"Bachelor’s degree (S1) in one of the following fields: Mathematics, Statistics, Data Analytics, or Computer Science.
Candidates with additional education or certification in Data Science will be considered a plus.
Proficient in SQL & Python for data processing and manipulation.
Understanding or experience in R programming, especially for statistical analysis.
Open to fresh graduates with a maximum of 2 years of work experience.
Experience in data analysis, machine learning, or relevant academic projects will be an added advantage.
Understanding or experience in credit scoring, including risk analysis and credit prediction.
Strong analytical thinking, good communication skills, and the ability to present data in an easily understandable format.",508
LinkedIn,Computer Science,MIS Analyst,PT Surya Artha Nusantara Finance,"Interpret data, analyze results using statistical techniques and provide reports using Tableau, Excel or other Reporting Tools.
Develop and implement databases, data collection systems, data analysis, and other strategies that optimize statistical efficiency and quality
Identify, analyze, and interpret trends or patterns in complex data sets
Create reports to monitor company performance
Carry out improvement projects related to database development and data pipelines
Create a management dashboard using the Tableau tool as a monitoring dashboard for the executive level and also the operational level
Perform data cleaning on data that will be used as analysis material
Develop visualizations, dashboards, and reports using tools such as Tableau, Power BI, or Excel
Bachelor’s degree in Mathematics, Statistics, Data Science, Computer Science, or a related field
Extensive experience with data analysis and machine learning tools (minimum SQL)
Deep understanding of statistical analysis, machine learning, and predictive modeling
Proven expertise in developing and deploying predictive models using techniques such as regression analysis, time series forecasting, and neural networks.
Proficiency in data visualization tools (e.g., Tableau). Familiarity with big data technologies.",509
LinkedIn,Computer Science,"SAP FI, CO, MM, PM",Accord Innovations,"SAP Project Management skills
Strong Analytical Skills
Experience in Plant Maintenance and Business Process analysis
Proven expertise in Project Implementation
Excellent problem-solving and communication skills
Ability to work on-site in the Jakarta Metropolitan Area
Bachelor's degree in Information Technology, Computer Science, Business Administration, or related field
Certification in SAP modules is a plus",510
LinkedIn,Computer Science,Information Technology Account Manager,PT Rapid Teknologi Indonesia,"Proficiency in Account Management and Information Technology
Strong Communication skills
Experience in Business Development and Sales
Excellent interpersonal and client relationship skills
Ability to work effectively in a team-oriented environment
Excellent problem-solving and negotiation skills
Bachelor's degree in Information Technology, Business, or a related field
Attractive appearance",511
LinkedIn,Computer Science,UI/UX Intern,PT INDONESIA EQUIPMENT CENTRE,"Conduct user research and translate findings into actionable design solutions.
Develop wireframes, mockups, and prototypes using Figma and Balsamiq.
Design user-friendly interfaces that align with system requirements and business goals.
Collaborate with developers and stakeholders to ensure seamless implementation.
Optimize UI/UX designs for responsiveness and accessibility.
Iterate on designs based on user feedback and usability testing.
Maintain design consistency across all digital platforms.
Bachelor's degree (or currently pursuing) in Design, Computer Science, or a related field.
Strong understanding of system design principles and user-centered design.
Proficiency in Figma for high-fidelity designs and Balsamiq for low-level wireframes.
Experience in creating intuitive and functional UI/UX solutions.
Ability to work collaboratively in a fast-paced environment.
Excellent problem-solving and communication skills.",512
LinkedIn,Computer Science,Project Management (Plastic Waste & Recycle),Recycling Village,"Develop, implement, and control the day-to-day activities of the project
Ensure the implementation of standard operating procedures for all operations processes
Coordinating and managing stakeholders, partners, and potential buyers relationship
Coordinate and provide support to supervisors, artisans, and other staff members to ensure that all tasks are completed on time and to the highest standard, and to resolve any problems that arise
Monitor production processes and identify areas for improvement to increase efficiency and reduce waste
Assist in managing inventory and ordering of supplies, ensuring that there is adequate stock to meet production demands
Provide regular reports on production performance, inventory levels, and any other relevant data
Create documentation and reporting of project related activities
Having a Bachelor's degree in enviromental engineering, or a related field
Proficient in Notion, Google Docs, Google Sheets, and other relevant software
Good attention to detail and ability to manage multiple tasks simultaneously
Good in creating pitch deck and networking
Good English knowledge will be a plus",513
LinkedIn,Computer Science,Exhibition Designer,PT. Maha Kreasi Indonesia,"Bachelor’s degree in Interior Design, Architecture, or a related field.
Proficient in design software such as AutoCAD, SketchUp, or Enscape.
Knowledge of materials, lighting, and construction techniques for stage production.
Excellent problem-solving skills and attention to detail.
Ability to collaborate with production teams and work under tight deadlines.
Willing to travel to project sites and oversee set execution.
Competitive Salary
Flexible working hours ( manage your own time )
Health Insurance
BPJSTK & BPJS Kesehatan
Cozy office
Casual attire",514
LinkedIn,Computer Science,QA Engineer Intern,Mayar,"Assist in testing new features, identifying bugs, and verifying fixes.
Write and execute manual test cases for web and mobile platforms.
Collaborate with engineers to understand product requirements and ensure quality.
Contribute to documentation and, where possible, automation processes.
Currently pursuing or recently completed a degree in Computer Science, Information Systems, or related field.
Strong analytical skills and keen attention to detail.
Understanding of software testing concepts.
Eagerness to learn, collaborate, and take initiative.
Experience with testing tools (Postman, Selenium, JIRA, etc.) is a plus.",515
LinkedIn,Computer Science,"Associate Programmer - Code Igniter & Phyton, Indonesia (m/f/d)",JAEGGI Hybridtechnologie AG,"Develop web applications using the CodeIgniter framework.
Identify and resolve software defects through debugging.
Conduct comprehensive testing of web applications.
Perform ongoing maintenance and enhancements for existing web applications.
Design, build, and manage AI development environments and supporting infrastructure.
Collaborate cross-functionally to ensure project success and timely completion.
A Diploma (D3) / Bachelor's Degree (S1) in Information Technology, Software Engineering, or a relevant field.
Mastery of CodeIgniter (CI) and a deep understanding of the PHP framework ecosystem.
Experience in building and developing web-based solutions.
Understanding of and interest in Artificial Intelligence (AI), with Python programming skills being highly desirable.
Vendor-based Contract
Placement in Wonokoyo, Beji, Pasuruan, East Java.",516
LinkedIn,Computer Science,Testing Management Program,CIMB Niaga,"Min. Bachelor Degree; Majoring Computer Science, Software Engineering or related
Min. GPA 3.00
Demonstrate basic ability of written/verbal communication
Able to work both individually/team
Detailed orientation and adequate analytical skill",517
LinkedIn,Computer Science,Data Center Engineer,PT. Megaroyal IT Comindo,"S1 degree in Engineering (Computer/Informatics) information Systems with GPA minimum 3.0, or
D3 degree in Engineering (Computer/Informatics) information Systems with GPA minimum 3.5, or
1-2 years working experience in data center preferred or fresh graduate
Basic scripting knowledge is a plus (Python, PowerShell, JavaScript, VRO)
Ability to work well independently or in a team
Willingness to travel for work is a must
Fast learner of monitoring products in all its technical details
Good understanding of network infrastructure and protocols. Such as SNMP and Modbus TCP/IPO or Modbus RTU Serial Communication
Logical and analytical skills in planning designs system topology
Proficiency in English
Familiarity with networking protocols, security, and related technologies Such as SNMP, and Modbus TCP/IP or Modbus RTU
Having knowledge of electrical power system, cabling and electrical cable installation, lighting system, point cable termination, QC testing electrical system
Installing, configuring, testing, and maintaining DCIM software
Provide hands-on technical expertise to troubleshoot and resolve electrical issues in a timely manner, ensuring minimal impact on data center operations
Responsible for keeping up to date with the product roadmap as well as understanding the scenarios, features and functions within each product and how these are applied to address business and technical problems
Maintain up to date documentation and record to support operational continuity and compliance requirements
Ensure work will be done according to project deadlines
Coordinate with internal deployment team on projects delivery to ensure every detail ordered are delivered correctly and on time",518
LinkedIn,Computer Science,Application Support Specialist,WE+ (PT KITA INDONESIA PLUS),"Responsibilities:
Troubleshooting technical issues.
Diagnosing and repairing faults.
Speaking to customers to quickly get to the root of their problem.
Providing timely and accurate customer feedback.
Talking customers through a series of actions to resolve a problem.
Following up with clients to ensure the problem is resolved.
Supporting the roll-out of new applications.
Managing multiple cases at one time.
Requirements:
Degree in computer science or information technology.
Prior experience in tech support, desktop support, or a similar role.
Understand Structured Query Language (SQL)
Mastering for business flow of the system
Proficiency in Windows/Linux/Mac OS.
Attention to detail and good problem-solving skills.
Excellent interpersonal skills.
Good written and verbal communication.
Willing to be placed in Lippo Thamrin",519
LinkedIn,Computer Science,Software Engineer,Neo Academy,"Develop, test, and deploy cross-platform web / mobile applications using Flutter.
Collaborate with the team to deliver seamless user experiences.
Integrate applications with cloud services from providers such as AWS, Google Cloud Platform (GCP), or Microsoft Azure.
Implement cloud-based solutions for storage, authentication, messaging, analytics, and other backend functions.
Troubleshoot, debug, and optimize application performance.
Maintain code quality, organization, and automation.
Stay updated with Flutter and cloud technology trends to suggest improvements.
Proven experience in mobile app development using Flutter and Dart.
Strong understanding of cloud services and architecture (AWS, GCP, Azure, or similar).
Experience integrating RESTful APIs, Firebase, or other backend services.
Familiarity with version control systems such as Git.
Familiarity with mobile app deployment to Google Play Store and Apple App Store.
Strong problem-solving skills and attention to detail.
Experience with cloud-native app development and serverless architectures.
Knowledge of containerization (Docker) and orchestration (Kubernetes) is a plus.
Familiarity with mobile app deployment to Google Play Store and Apple App Store.
Understanding of security best practices in mobile and cloud applications.",520
LinkedIn,Computer Science,IT Barametal L1 Engineer,"Metrocom Global Solusi, PT.","Administer and maintain Linux-based baremetal servers and systems
Monitor system performance and ensure optimal server uptime
Respond promptly to system alerts and incidents during assigned shifts
Collaborate effectively with cross-functional teams to resolve technical issues
Participate in 24/7 shift rotations to provide continuous system support
Document system configurations, procedures, and troubleshooting steps
Escalate complex issues to senior engineers when necessary
Linux Administration Experience: Hands-on experience with Linux system administration
Proactive Mindset: Self-motivated with the ability to anticipate and prevent issues
Strong Teamwork Skills: Excellent collaboration and communication abilities
Adaptability: Thrives in challenging environments and performs well under pressure
Responsiveness: Quick to respond during shift work and emergency situations
Flexibility: Willing to work rotating shifts including nights, weekends, and holidays
Solid understanding of Linux fundamentals and architecture
Experience with Linux OS installation and configuration
Basic troubleshooting skills for Linux-related issues
Familiarity with server hardware and baremetal environments
Knowledge of system monitoring tools and practices",521
LinkedIn,Computer Science,Risk Analytics and MIS Specialist (BNPL),Atome,"Support unsecured retail consumer financing risk team by performing risk analysis, tests and modelling to optimize portfolio quality, business growth and profitability.
Collaborate with stakeholders to ensure the availability, integrity and quality of data and reporting for internal, regulator and various funding partners.
Assist system parameter changes, rule engine strategy management, development of reporting automation & dashboards and other ad hoc projects.
Organize documentation and log of risk strategy changes.
Escalate key risk issues to Senior Management to allow timely risk mitigation.
Proficiency in data science programming languages such as SQL or Python or R.
Bachelor’s / Master’s degree from reputable universities, with major in Computer Science, Information System, IT, Informatics, Mathematics, Statistics, Actuary, Engineering or any other similar fields.
Fluency in English both in written & verbal. Chinese/Mandarin is a plus.
Fresh graduate is welcome to apply.",522
LinkedIn,Computer Science,Cyber Security Engineer,Protergo,"Troubleshooting deployment issues in order to fix bugs in software or hardware components
Providing technical support to clients in order to help them troubleshoot their own issues
Working with clients to develop a deployment plan that meets their needs
Monitoring and maintaining the health of servers and other network devices
Deploying new systems, updating existing systems, or decommissioning old systems as needed
Designing and implementing backup solutions to protect against data loss
Maintaining documentation of all steps taken during each deployment project
Helping to create documentation for new software releases or hardware updates
Testing new software releases to ensure that they work as expected
A bachelor's degree in computer science, IT, or a relevant technical field
A year of experience in an IT role, particularly with deployment and technology migration
Understand AlivenVault, Wazuh, Qradar, sentinel Azure, and other SIEM
Understand Elasticsearch, Logstash and Kibana
Understand Linux system administration
Strong problem-solving and analytical abilities
Excellent communication and organizational skills",523
LinkedIn,Computer Science,Architectural Drafter,PT PUTRA DWI MANDIRI,"-Communicating with Architects & Field Teams.
-DRAFT with AutoCAD and Sketchup.
-The basis of architecture in design and technical.
-Adjust the Schedule Project and Pictures with the implementation in the field.",524
LinkedIn,Computer Science,Officeless Implementor / Digital Transformation Engineer,PT GTech Digital Asia,"Customize vertical products based on clients' specific needs using the Officeless Operating System (OOS).Mekari
Collaborate with Business Consultants to document all customizations.Mekari
Enhance the performance of front-end websites (mobile and web) using OOS.Mekari+4Mekari+4foundit indonesia+4
Develop user interfaces with React JS and manage server-state with React Query.
Experience in implementing Officeless Workflow System
Experience in Customizing/Custom Development of Officeless
Workflow System
Experiences as full-stack developer.
Excellent programming logic, fast learner and self-dependent.
Familiar with container (Docker) concept.
Experience In front-end programming using JavaScript (must be fluent / expert in JavaScript programming), HTML and CSS.
Experience in Back-end programming Microsoft C#.Net and MySQL Database.",525
LinkedIn,Computer Science,Graphic Designer,Fashion Forth Indonesia,"Graphics and Graphic Design skills
Logo Design and Branding skills
Typography skills
Experience in creating visual assets for marketing and branding purposes
Proficiency in design software such as Adobe Creative Suite
Strong portfolio showcasing design capabilities
Excellent attention to detail and creativity
Degree in Graphic Design or related field is a plus",526
LinkedIn,Computer Science,Pengajar Freelance Geografi/Matematika/Sosiologi/B.Inggris,PT Kreasi Edulab Indonesia,"Cooperation and Social Work skills
Psychiatry and Sociology knowledge
Experience in treatment and educational settings
Strong communication and interpersonal skills
Bachelor's degree in Education or related field
Previous teaching experience is a plus",527
LinkedIn,Computer Science,Mobile Developer,Akuntplus,"Participate in requirements analysis
Collaborate with internal teams to produce software design and architecture
Write clean, scalable code using Flutter framework & Dart languages
Test and deploy applications and systems
Revise, update, refactor and debug code
Follow source code checking process to maintain the code in Git Version Control
Create low level requirement document in discussion with different teams and technical specification document as needed
Ensure the best possible performance, quality, and responsiveness of applications
Help maintain code quality, organization, and automatization
Proven experience as a Flutter Developer or similar role, with a strong portfolio of mobile applications developed using Flutter
Proficiency in Dart programming language and Flutter framework
Understanding of mobile app design principles and UI/UX best practices
Familiarity with architecture styles/APIs (REST, RPC) and Git Version Control
Understanding of Agile methodologies
Excellent troubleshooting and communication skills
Attention to detail
BSc/BA in Computer Science, Engineering or a related field",528
LinkedIn,Computer Science,Deployment Engineer,PT FIRST WAP INTERNATIONAL (1rstWAP),"Collect customer and stakeholders' feedback on product improvements.
Analyse feedback and translate it into feasible software requirement specifications.
Assess together with stakeholders the priorities of the work.
Work together in a team of Software Architects and Technical Writers to write down and specify how the new development should look, with prototypes and mock-ups.
Monitor and give feedback to developers on the expected behaviour of a new concept.
Plan the work on a Development Roadmap together with the Development and Project Managers.
Good knowledge of and experience with Linux, MySQL, using MyBatis, RabbitMQ, Hibernate, Redmine, and GIT.
Familiar with RHEL and related tools (SSH, PuTTY, Telnet, WinSCP, etc). Virtual Machines-based installations, AWS, as well as bare-metal-based installations.
Hold a bachelor's degree in Technical fields or any related field.
Preferably: you have worked before as a Business Analyst or Technical Writer.
Preferably: already has a passport.
Fluent in English, both written and spoken.
Willing to work onsite in Jakarta Selatan.",529
LinkedIn,Computer Science,Visual Effects Artist,GracyWoods Games Ltd.,"Proficiency in Autodesk Maya for visual effects and animation
Strong skills in Lighting and Compositing for game environments
Experience in Animation techniques applicable to game development
Understanding of Game Development processes and workflows
Excellent communication and collaboration skills
Ability to work independently and remotely
Experience in the gaming industry is a plus
Bachelor's degree in Animation, Visual Effects, Game Design, or related field is beneficial",530
LinkedIn,Computer Science,Enterprise Resources Planning Project Manager,PT Jasa Web Indonesia (Webtocrat Motion Group),"Experience in ERP Implementations and expertise in Enterprise Resource Planning (ERP) systems
Strong analytical skills and experience in Budgeting
Knowledge of Business Processes and optimization techniques
Excellent project management and organizational skills
Ability to work on-site in Surabaya
Strong communication and team collaboration abilities
Bachelor's degree in Information Technology, Business Management, or a related field
Experience in the software or technology industry is a plus",531
LinkedIn,Computer Science,UiPath Developer,PT Berca Hardayaperkasa,"Expertise in Robotics and Process Automation
Strong Analytical Skills and ability to troubleshoot and resolve issues
Bachelor's degree in Computer Science, Engineering, or a related field
Understand and be able to operate the UiPath RPA Orchestrator.
Understand and be able to develop RPA workflows in UiPath using the REFramework approach.
Understand the Orchestrator API for integration needs with third-party systems.",532
LinkedIn,Computer Science,Golang Developer (for FinTech/Leasing Industry),SIGMATECH,"Preferably a Bachelor’s Degree in Computer Science, Engineering, or Business field Technology related experience and backgrounds are preferred
Min 2 yrs work experience with Go lang and one of golang frameworks e.g: beego, echo,gin
Excellent analytical, problem-solving skills and troubleshooting skills and diagnostic intuition.
Proficient with RDBMS (PostgreSQL, MS SQL Server, MySql, etc)
Proficient in HTTP, Web Services, OAuth and Restful APIs
Experience with OOP and Design Pattern
Experience with Git and GitFlow
Strong understanding of Data Structures, Algorithms, and Computer Science fundamentals is a MUST",533
LinkedIn,Computer Science,Dynamics AX Consultant,PT Rapid Teknologi Indonesia,"Analytical Skills and Consulting abilities
Experience in Business Process analysis
Project Management skills
Integration expertise
Strong problem-solving abilities
Excellent communication and interpersonal skills
Bachelor's degree in Computer Science, Information Technology, or related field
Microsoft Dynamics AX certification is a plus",534
LinkedIn,Computer Science,Banking Academy for IT,OCBC Indonesia,"Fresh graduate in computer and technology major study or havemaximum2 years of working experience
Minimum final GPA of 3.00 / 4.00
Familiar with some programming languages (e.g Java, Golang, etc)
Showing your enthusiasm in application development
Work location: BSD City, Tangerang (onsite)",535
LinkedIn,Computer Science,Infrastructure Specialist,Upwork Agency,"Configuring and optimizingAWS Global Accelerator
Deploying and managingbare metal EC2 instances
Implementingsession stickinessat the server level
Node replicationand distributed system design
Building and maintainingRESTful APIs in Go (Golang)
Database management(MongoDB, ScyllaDB, or similar)
Ensuringminimal latencyfrom client to user
Implementing robustAPI authentication and security
Log monitoring, observability, and health checks
Identifying and reducingCPU spikes and memory leaks",536
LinkedIn,Computer Science,WordPress Performance Marketing Developer,Medor.id,"Design and develop responsive, fast-loading landing pages using WordPress
Implement SEO best practices and performance optimization (load time, Core Web Vitals, etc.)
Integrate and manage tracking tools such as Google Analytics, Google Tag Manager, and Facebook Pixel
Monitor and report conversion metrics (leads, signups, purchases) and user behavior
Collaborate with marketing teams to align landing pages with campaign goals
Conduct A/B testing and implement improvements based on performance data
Ensure proper event tracking across forms, buttons, and funnels
Troubleshoot and resolve website and tracking issues quickly.
An Indonesian citizen.
Proven experience with WordPress (custom themes, page builders like Elementor or Gutenberg)
Strong understanding of performance marketing, conversion funnels, and user experience
Proficiency in Google Analytics (GA4), Google Tag Manager, and tracking implementations
Familiarity with HTML, CSS, and JavaScript
Experience with A/B testing tools and conversion rate optimization (CRO)
Attention to detail, strong analytical mindset, and data-driven approach
Fluent in English, Good communication skills and ability to collaborate cross-functionally",537
